{
  "title": "Meetings: a refresher",
  "allowTestOut": true,
  "sections": [
    { "id": 1, "title": "Writing an agenda", "requires": [] },
    { "id": 3, "title": "Running the discussion", "requires": [] },
    { "id": 4, "title": "Decisions and follow-up", "requires": [3] }
  ],
  "questions": [
    {
      "id": "agenda", "section": 1, "text": "What should people learn from the agenda before a meeting?",
      "options": [
        { "id": "attendees", "text": "Only who will attend" },
        { "id": "outcomes", "text": "The topics, goals and time for each item" },
        { "id": "everything", "text": "Everything the organiser knows about each topic" }
      ],
      "correct": "outcomes", "explanation": "People can prepare when they know the topics, goals and time for each item."
    },
    {
      "id": "discussion", "section": 3, "text": "One person does most of the talking. What should you do as the facilitator?",
      "options": [
        { "id": "invite", "text": "Pause and invite others to speak" },
        { "id": "wait", "text": "Let them speak until the meeting ends" },
        { "id": "delegate", "text": "Ask the note taker to decide for everyone" }
      ],
      "correct": "invite", "explanation": "Invite others to speak so everyone can contribute."
    },
    {
      "id": "follow-up", "section": 4, "text": "What should you confirm before the meeting ends?",
      "options": [
        { "id": "equal-time", "text": "That everyone spoke for the same amount of time" },
        { "id": "actions", "text": "The decisions, who will do each task and by when" },
        { "id": "next-meeting", "text": "That another meeting is already booked" }
      ],
      "correct": "actions", "explanation": "Confirm what was decided, who will do each task and by when."
    }
  ]
}
